{
  "contractVersion": "d9-native-genesis/0.1.0-rc.6",
  "contractDigest": "60cf55ac9ccb1fe4fede234d83eff072fcb642b898343f94e2c2bc4b97be9416",
  "inputDigest": "64427427d11e7595275aa948ad37f9726f95873e2d95fa71a33eab843395b921",
  "build": {
    "nodeCommit": "29a01f16c208b28485c39acec4a0bb54ae6ebb98",
    "palletsCommit": "48b01519ab9d3ce1d43c3a58cdaf0f7309ee93bf",
    "cargoLockDigest": "0000000000000000000000000000000000000000000000000000000000000384",
    "wasmDigest": "0000000000000000000000000000000000000000000000000000000000000385",
    "nativegenCommit": "0000000000000000000000000000000000000386",
    "runtimeConfigDigest": "0000000000000000000000000000000000000000000000000000000000000387"
  },
  "rawSpecDigest": "57c30e374d657671c92400f2b2744803fbf09993c97ca41618058e52792a922f",
  "checkerReportDigest": "fa4d52b6811a8ce615be7a14b49e6cccdb08f223c2cad7d47a1cc2486edb7ecb"
}
